,title,cited_by,year,tweeted_by
444,Doxazosin nanoencapsulation improves its in vitro antiproliferative and anticlonogenic effects on breast cancer cells,4,2017,1
445,ST6GALNAC5 expression decreases the interactions between breast cancer cells and the human blood-brain barrier,24,2016,1
446,Unsupervised clustering of quantitative image phenotypes reveals breast cancer subtypes with distinct prognoses and molecular pathways,38,2017,1
447, Applied mathematics and nonlinear sciences in the war on cancer,20,2016,1
448,Applying data mining techniques to improve breast cancer diagnosis,35,2016,1
449,Surgical Management of the Axilla in Elderly Women With Node-positive Breast Cancer,0,2020,1
450,Economic evaluation of letrozole for early breast cancer in a health resource-limited setting,3,2018,1
451,Individualised selection of left‐sided breast cancer patients for proton therapy based on cost‐effectiveness,0,2020,1
452,AgNPs loaded microemulsion using gallic acid inhibits MCF-7 breast cancer cell line and solid ehrlich carcinoma,2,2019,1
453,Potentialities of Inverse Scattering Techniques for Breast Cancer Imaging at Millimeter-Waves Frequencies,0,2020,1
454,Dose variability in different lymph node levels during locoregional breast cancer irradiation: the impact of deep-inspiration breath hold,8,2019,1
455,Breast Cancer Segmentation From Thermal Images Based on Chaotic Salp Swarm Algorithm,4,2020,1
456,Development of a three-dimensional surrogate geometry of the breast and its use in estimating the thermal conductivities of breast tissue and breast lesions based on …,2,2019,1
457,… imputation and synthetic data simulation through modeling graphical probabilistic dependencies between variables (ModGraProDep): An application to breast cancer …,0,2020,1
458,Multiple mediation analysis with survival outcomes: with an application to explore racial disparity in breast cancer survival,6,2019,1
459,Application of arteether-loaded polyurethane nanomicelles to induce immune response in breast cancer model,14,2017,1
460,The optimal radiation dose to induce robust systemic anti-tumor immunity,17,2018,1
461, A network modeling approach to elucidate drug resistance mechanisms and predict combinatorial drug treatments in breast cancer,19,2017,1
462,FAK is required for tumor metastasis-related fluid microenvironment in triple-negative breast cancer,12,2019,1
463, BCL-2 expression aids in the immunohistochemical prediction of the Oncotype DX breast cancer recurrence score,2,2018,1
464,"… success, technique efficacy and complications of minimally-invasive imaging-guided percutaneous ablation procedures of breast cancer: A systematic review and …",47,2017,1
465,Mathematical modelling of plasticity and phenotype switching in cancer cell populations,11,2017,1
466, Validation of Residual Cancer Burden as Prognostic Factor for Breast Cancer Patients After Neoadjuvant Therapy,2,2019,1
467,Anti-tumor efficacy of an integrated methyl dihydrojasmonate transdermal microemulsion system targeting breast cancer cells: in vitro and in vivo studies,27,2017,1
468,Cancer cell plasticity: rapid reversal of chemosensitivity and expression of stemness markers in lung and breast cancer tumorspheres,11,2017,1
469,Multi-label transfer learning for the early diagnosis of breast cancer,9,2020,1
470,Mathematical modeling of tumor–tumor distant interactions supports a systemic control of tumor growth,25,2017,1
471, Effectiveness of breast cancer screening policies in countries with medium-low incidence rates,2,2018,1
472, Investigation of novel regulation of n-myristoyltransferase by mammalian target of rapamycin in breast cancer cells,5,2018,1
473,Maximized inter-class weighted mean for fast and accurate mitosis cells detection in breast cancer histopathology images,5,2017,1
474, Long non-coding RNAs as prognostic markers in human breast cancer,92,2016,1
475,Longitudinal liquid biopsy and mathematical modeling of clonal evolution forecast time to treatment failure in the PROSPECT-C phase II colorectal cancer clinical trial,87,2018,1
476, Detection and classification the breast tumors using mask R-CNN on sonograms,18,2019,1
477, Mapping of female breast cancer incidence and mortality rates to socioeconomic factors: From univariate analysis to path diagram analysis,0,2020,1
478,Personalized early detection and prevention of breast cancer: ENVISION consensus statement,2020,2020,1
479,Breast cancer candidate gene detection through integration of subcellular localization data with protein-protein interaction networks,1,2020,1
480,"Targeted dose enhancement in radiotherapy for breast cancer using gold nanoparticles, part 2: a treatment planning study",10,2017,1
481,"SU‐G‐BRC‐13: Model Based Classification for Optimal Position Selection for Left‐Sided Breast Radiotherapy: Free Breathing, DIBH, Or Prone",1,2016,1
482, Mathematical modeling of therapy-induced cancer drug resistance: connecting cancer mechanisms to population survival rates,63,2016,1
483,AI‐Enhanced Diagnosis of Challenging Lesions in Breast MRI: A Methodology and Application Primer,0,2020,1
484,Current mathematical models for cancer drug discovery,12,2017,1
485,Classification of Breast Cancer Malignancy Using Machine Learning Mechanisms in TensorFlow and Keras,0,2019,1
486,Network modularity and hierarchical structure in breast cancer molecular subtypes,8,2018,1
487, Validating a breast cancer score in Spanish women. The MCC-Spain study,5,2018,1
488,Towards breast cancer rotational radiotherapy with synchrotron radiation,1,2016,1
489,"NCCN guidelines insights: breast cancer, version 1.2017",256,2017,1
490,Using â€˜ Costs Statesâ€™ in a Semi-Markov Model to Estimate Cost-Effectiveness with an Illustration for Metastatic HER2+ Breast Cancer in the Czech Republic,0,2020,1
