,title,cited_by,year,tweeted_by
0,Optimal control analysis of a mathematical model for breast cancer,20,2018,1
1,Modeling combination therapy for breast cancer with BET and immune checkpoint inhibitors,26,2018,1
2, Serum upar as biomarker in breast cancer recurrence: A mathematical model,8,2016,1
3, Consolidated mathematical growth model of the primary tumor and secondary distant metastases of breast cancer (CoMPaS),5,2018,1
4,Analysis of a breast cancer mathematical model by a new method to find an optimal protocol for HER2-positive cancer,0,2020,1
5, Breast cancer-derived lung metastases show increased pyruvate carboxylase-dependent anaplerosis,101,2016,1
6, Mathematical modeling of tumor growth: the MCF-7 breast cancer cell line,3,2019,1
7,The GRHL2/ZEB feedback loop—a key axis in the regulation of EMT in breast cancer,45,2017,1
8, Model driven optimization of antiangiogenics+ cytotoxics combination: application to breast cancer mice treated with bevacizumab+ paclitaxel doublet leads to …,23,2017,1
9, Predicting breast cancer response to neoadjuvant chemotherapy based on tumor vascular features in needle biopsies,9,2019,1
10, Experimentally-driven mathematical modeling to improve combination targeted and cytotoxic therapy for HER2+ breast cancer,4,2019,1
11,HPM of estrogen model on the dynamics of breast cancer,3,2018,1
12,A mathematical model for phase transition regulation on the cell cycle in early stage of breast cancer,0,2019,1
13,Mathematical modeling links pregnancy-associated changes and breast cancer risk,6,2017,1
14,Mathematical Modeling of Triple Negative Breast Cancer with Doxorubicin,0,2020,1
15,An Ito stochastic differential equations model for the dynamics of the MCF-7 breast cancer cell line treated by radiotherapy,8,2016,1
16, Bifurcation Analysis of a Mathematical Model of Tumor Growth in MCF-7 Breast Cancer Cell Line,0,2020,1
17,A PROGNOSTIC IMMUNOTHERAPY MODEL FOR 4T1 BREAST CANCER WITH COMBINED CYCLOPHOSPHAMIDE AND TLR AGONIST,0,2020,1
18,Size‐optimized Ultrasmall porous silica nanoparticles depict vasculature‐based differential targeting in triple negative breast cancer,9,2019,1
19, Combination therapy of cancer with cancer vaccine and immune checkpoint inhibitors: A mathematical model,48,2017,1
20,Model-based cardiac dose estimation in radiation treatment of left breast cancer,2,2018,1
21,Galerkin finite element method for cancer invasion mathematical model,16,2017,1
22,A Mathematical analysis of Local Stability and Optimal Control of Breast Cancer,0,2017,1
23,Segmentation of breast MR images using a generalised 2D mathematical model with inflation and deflation forces of active contours,7,2019,1
24,Towards personalized computer simulations of breast cancer treatment,0,2020,1
25, A geometrically-constrained mathematical model of mammary gland ductal elongation reveals novel cellular dynamics within the terminal end bud,28,2016,1
26, Flexible ultrasonic array for breast-cancer diagnosis based on a self-shape–estimation algorithm,0,2020,1
27,Verification and Validation of Computer Models for Diagnosing Breast Cancer Based on Machine Learning for Medical Data Analysis,3,2019,1
28,A mathematical model to study breast cancer growth,0,2017,1
29, Mathematical modeling of ER-positive breast cancer treatment with AZD9496 and palbociclib,0,2020,1
30,Patient-specific neoadjuvant regimens for breast cancer identified via image-driven mathematical modeling,0,2020,1
31,A mathematical model of tumor hypoxia targeting in cancer treatment and its numerical simulation,8,2017,1
32,A mathematical model of antibody-dependent cellular cytotoxicity (ADCC),16,2018,1
33,Three-dimensional image-based mechanical modeling for predicting the response of breast cancer to neoadjuvant therapy,36,2017,1
34,Innovative mathematical model links TRPV6 genotype to high triple negative breast cancer mortality rate in African-American females,0,2019,1
35,PCN349-CAN WE APPLY THE UTILITY PREDICTION MATHEMATICAL MODEL FOR RECURRENT METASTATIC BREAST CANCER TO JAPANESE PATIENTS?,0,2018,1
36, A predictive mathematical modeling approach for the study of doxorubicin treatment in triple negative breast cancer,18,2017,1
37, Exosomal miRs in lung cancer: A mathematical model,10,2016,1
38,"Do breast cancer patients benefit from surgery? Hypotheses, mathematical models and false beliefs",2,2017,1
39, Characterization of multicellular breast tumor spheroids using image data-driven biophysical mathematical modeling,0,2020,1
40,Towards integration of 64Cu-DOTA-Trasztusumab PET-CT and MRI with mathematical modeling to predict response to neoadjuvant therapy in HER2+ breast cancer,0,2020,1
41,A mathematical model of breast cancer cell motion through a microfluidic device,0,2017,1
42, Precision medicine with imprecise therapy: computational modeling for chemotherapy in breast cancer,17,2018,1
43,Dynamics of Breast Cancer Under Different Rates of Chemoradiotherapy,1,2019,1
44,Environmental factors in breast cancer invasion: a mathematical modelling review,14,2017,1
45,Mathematical modeling and control for cancer treatment with cold atmospheric plasma jet,12,2019,1
46,Global dynamics of a breast cancer competition model,2017,2017,1
47,"A polycyclic aromatic hydrocarbon-enriched environmental chemical mixture enhances AhR, antiapoptotic signaling and a proliferative phenotype in breast cancer …",0,2020,1
48, A mathematical model for enzyme clustering in glucose metabolism,5,2018,1
49,Modeling of electrical impedance tomography to detect breast cancer by finite volume methods,3,2017,1
50," A mathematical model for IL-6-mediated, stem cell driven tumor growth and targeted treatment",15,2018,1
51,Formulation and In-vitro Characterisation of Fulvestrant loaded liposomes for breast cancer therapy,2017,2017,1
52,Abstract P1-06-05: Image driven biophysical mathematical modeling of multicellular breast tumor spheroids,0,2020,1
53,The role of the tumor microenvironment in glioblastoma: A mathematical model,36,2016,1
54,Punctuated copy number evolution and clonal stasis in triple-negative breast cancer,249,2016,1
55, Mathematical modelling of Her2 (ErbB2) PI3K/AKT signalling pathways during breast carcinogenesis to include PTPD2,0,2020,1
56,A mathematical-experimental approach for predicting host responses in a preclinical model for trastuzumab-treated HER2+ breast cancer,0,2018,1
57,Breast cancer diagnosis approach based on meta-heuristic optimization algorithm inspired by the bubble-net hunting strategy of whales,25,2016,1
58,Prediction of the optimal dosing regimen using a mathematical model of tumor uptake for immunocytokine-based cancer immunotherapy,20,2018,1
59,On Consolidated Predictive Model of the Natural History of Breast Cancer Considering Primary Tumor and Primary Distant Metastases Growth,1,2017,1
60,Energetic regulation of coordinated leader–follower dynamics during collective invasion of breast cancer cells,25,2019,1
61,XIAP regulation by MNK links MAPK and NFκB signaling to determine an aggressive breast cancer phenotype,19,2018,1
62,Breast cancer detection using k-nearest neighbor machine learning algorithm,38,2016,1
63, The role of myosin II in glioma invasion: A mathematical model,20,2017,1
64,Breast cancer screening in young women,19,2018,1
65, PO-139 Identify rational drug combinations for triple negative breast cancer by integrative network modelling,0,2018,1
66,Abstract P4-08-03: Mathematical modeling of the unfolded protein response pathway in breast cancer cells,0,2017,1
67, Characterizing and quantifying the effects of breast cancer therapy using mathematical modeling,4,2016,1
68,A chemotaxis-based explanation of spheroid formation in 3D cultures of breast cancer cells,8,2019,1
69,3D printed acoustically transparent pressure sensor for breast cancer detection,0,2020,1
70,[CITATION][C] Development and Validation of a Predictive Model of Chemotherapy in Triple Negative Breast Cancer,0,2017,1
71,Exosomal microRNA concentrations in colorectal cancer: A mathematical model,6,2017,1
72, Computer modeling of some anti-breast cancer compounds,0,2020,1
73,Breast cancer prediction: a comparative study using machine learning techniques,1,2020,1
74,Dexamethasone increases cisplatin-loaded nanocarrier delivery and efficacy in metastatic breast cancer by normalizing the tumor microenvironment,19,2019,1
75,Mathematical modelling of the interaction between cancer cells and an oncolytic virus: insights into the effects of treatment protocols,20,2018,1
76,Application of Support Vector Machine to Predict the Onset of Breast Cancer in Mouse Model,0,2018,1
77,PO-136 Studying pathway interactions and dynamics to predict cell responses to chemotherapeutic treatment in breast cancer cells,0,2018,1
78,Toward Personalized Computer Simulation of Breast Cancer Treatment: A Multiscale Pharmacokinetic and Pharmacodynamic Model Informed by Multitype Patient …,5,2019,1
79, Mathematical modeling of drug-induced receptor internalization in the HER2-positive SKBR3 breast cancer cell-line,4,2019,1
80,"Analysis of a positive CVFE scheme for simulating breast cancer development, local treatment and recurrence",1,2017,1
81,Understanding the antiangiogenic effect of metronomic chemotherapy through a simple mathematical model,8,2016,1
82,Absolute reconstructions using rotational electrical impedance tomography for breast cancer imaging,39,2016,1
83,Modeling of breast cancer through evolutionary game theory,0,2018,1
84,Abstract P4-04-06: Study of the mutational landscape of normal and pregnant breast to predict pregnancy-associated breast cancer risk,0,2019,1
85,Stochastic Gompertzian model for breast cancer growth process,0,2017,1
86, Alteration of specific cytokine expression patterns in patients with breast cancer,11,2019,1
87,Analysis of blood markers for early breast cancer diagnosis,20,2018,1
88,Synergistic effect of quercetin and pH-responsive DEAE-chitosan carriers as drug delivery system for breast cancer treatment,18,2018,1
89,Mathematical modeling in scheduling cancer treatment with combination of VEGF inhibitor and chemotherapy drugs,7,2019,1
90,Focused ultrasound ablation for the treatment of patients with localized deformed breast cancer: computer simulation,3,2019,1
91, MASTL overexpression promotes chromosome instability and metastasis in breast cancer,19,2018,1
92,Abstract LB-011: Experimentally derived multi-state model of chemoresistance to characterize phenotypic dynamics in breast cancer,0,2017,1
93," An agent-based model of triple-negative breast cancer: the interplay between chemokine receptor CCR5 expression, cancer stem cells, and hypoxia",18,2017,1
94,Cell–cell adhesion and 3D matrix confinement determine jamming transitions in breast cancer invasion,3,2020,1
95, A mathematical model of thyroid tumor,14,2016,1
96,Axillary lymph node sonographic features and breast tumor characteristics as predictors of malignancy: a nomogram to predict risk,7,2017,1
97,… screening schedules under varying resource constraints for planning breast cancer control programs in low-and middle-income countries: a mathematical study,0,2020,1
98, correlation-centred variable selection of a gene expression signature to predict breast cancer metastasis,0,2020,1
99,"First person profile: Larry Norton, MD: A world‐renowned breast cancer researcher, Dr. Norton has used his passion for music and math to revolutionize oncology",0,2019,1
100,A mathematical prediction model incorporating molecular subtype for risk of non-sentinel lymph node metastasis in sentinel lymph node-positive breast cancer …,5,2018,1
101,PO-137 Computational metabolism modelling predicts risk of relapse in breast cancer patients,0,2018,1
102,Infiltration of CD8+ T cells into tumor cell clusters in triple-negative breast cancer,22,2019,1
103,Revisiting dosing regimen using pharmacokinetic/pharmacodynamic mathematical modeling: densification and intensification of combination cancer therapy,20,2016,1
104,Radioresistance of the breast tumor is highly correlated to its level of cancer stem cell and its clinical implication for breast irradiation,18,2017,1
105,In silico simulation of a clinical trial with anti-CTLA-4 and anti-PD-L1 immunotherapies in metastatic breast cancer using a systems pharmacology model,15,2019,1
106," Cost–effectiveness of risk-based breast cancer screening programme, China",11,2018,1
107,Mathematical modeling for optimal control of breast cancer,0,2019,1
108, Theory and experimental validation of a spatio-temporal model of chemotherapy transport to enhance tumor cell kill,34,2016,1
109,Mathematical modeling of the effects of tumor heterogeneity on the efficiency of radiation treatment schedule,9,2018,1
110,Modeling procedures for breast cancer diagnosis based on clinical elastography images,3,2018,1
111, Understanding the connection between nanoparticle uptake and cancer treatment efficacy using mathematical modeling,18,2018,1
112, Consolidated mathematical growth Model of Breast Cancer CoMBreC,0,2018,1
113,A mathematical modelling for estradiol influence on DNA damage response and G1/S transition phase regulations in early stage of breast cancer,0,2019,1
114, Software System for Automated Assessment of the Breast Cancer Risk from Mammograms,0,0,1
115,Prediction of breast cancer using support vector machine and K-Nearest neighbors,38,2017,1
116,Breast cancer diagnosis in DCE-MRI using mixture ensemble of convolutional neural networks,72,2017,1
117,Multidrug cancer therapy in metastatic castrate-resistant prostate cancer: an evolution-based strategy,20,2019,1
118,Mathematical Modeling of the Role of Survivin on Dedifferentiation and Radioresistance in Cancer,22,2016,1
119,Computer-aided diagnosis for the identification of breast cancer using thermogram images: A comprehensive review,12,2019,1
120,Prediction potential of serum miR-155 and miR-24 for relapsing early breast cancer,17,2017,1
121, A mathematical model for the effect of obesity on cancer growth and on the immune system response,27,2016,1
122,Mathematical modeling of tumor-induced immunosuppression by myeloid-derived suppressor cells: Implications for therapeutic targeting strategies,10,2018,1
123,MRF‐ANN: a machine learning approach for automated ER scoring of breast cancer immunohistochemical images,17,2017,1
124,The role of exosomes in pancreatic cancer microenvironment,24,2018,1
125,Data mining algorithms to compute mixed concepts with negative attributes: an application to breast cancer data analysis,22,2016,1
126,A Mathematical Model of the Transition from Normal Hematopoiesis to the Chronic and Accelerated-Acute Stages in Myeloid Leukemia,6,2020,1
127,Identifying relations between imaging phenotypes and molecular subtypes of breast cancer: model discovery and external validation,41,2017,1
128,Machine learning and mechanistic modeling for prediction of metastatic relapse in early-stage breast cancer,6,2020,1
129,A mathematical model for chemoimmunotherapy of chronic lymphocytic leukemia,7,2019,1
130,Comparison between stochastic support vector machine (stochastic SVM) and Fuzzy Kernel Robust C-Means (FKRCM) in breast cancer classification,1,2019,1
131,Bio-inspired swarm techniques for thermogram breast cancer detection,21,2016,1
132, … /Ib clinical trial of metronomic chemotherapy based on a mathematical model of oral vinorelbine in metastatic non-small cell lung cancer and malignant pleural …,15,2016,1
133,Monte Carlo calculation of conversion coefficients for dose estimation in mammography based on a 3D detailed breast model,9,2017,1
134,Determining the impact of the major prognostic factors in breast cancer,0,2017,1
135,Tumor Characterization using Unsupervised Learning of Mathematical Relations within Breast Cancer Data,0,2020,1
136,Qualitative microwave imaging of breast cancer with contrast agents,3,2019,1
137,[CITATION][C] Values of a mathematical model for predicting the survival of patients with triple negative breast cancer depending on androgen receptors,2020,2020,1
138,A mathematical model of tumour growth with Beddington–DeAngelis functional response: a case of cancer without disease,5,2018,1
139,"Safety and efficacy study of metronomic vinorelbine, cyclophosphamide plus capecitabine in metastatic breast cancer: a phase II trial",26,2017,1
140,"High-content, cell-by-cell assessment of HER2 overexpression and amplification: a tool for intratumoral heterogeneity detection in breast cancer",1,2019,1
141,COX-2 inhibitors: a novel strategy in the management of breast cancer,60,2016,1
142,All‐cause mortality versus cancer‐specific mortality as outcome in cancer screening trials: A review and modeling study,7,2019,1
143,A mathematical model of dielectrophoretic data to connect measurements with cell properties,8,2019,1
144, Mathematical modelling of breast cancer thermo-therapy treatment: Ultrasound-based approach,1,2016,1
145,A new prospect in magnetic nanoparticle-based cancer therapy: Taking credit from mathematical tissue-mimicking phantom brain models,17,2017,1
146,Elucidating cancer metabolic plasticity by coupling gene regulation with metabolic pathways,67,2019,1
147,Optimization of skin cooling by computational modeling for early thermographic detection of breast cancer,13,2018,1
148, Early detection and treatment strategies for breast cancer in low-income and upper middle-income countries: a modelling study,25,2018,1
149, The occurrence of genetic alterations during the progression of breast carcinoma,9,2016,1
150," … Biology Approach of Understanding the Effect of Raphanus sativus Extract on the Pathogenesis of Chronic Myeloid Leukemia, Breast and Colon Cancer",0,2016,1
151, Breast cancer vaccination comes to age: impacts of bioinformatics,11,2018,1
152, META-HEURISTIC OPTIMIZATION ALGORITHMS BASED FEATURE SELECTION FOR CLINICAL BREAST CANCER DIAGNOSIS,1,2018,1
153,The Harsh Microenvironment in Early Breast Cancer Selects for a Warburg Phenotype,0,2020,1
154,A logical framework for modelling breast cancer progression,4,2018,1
155,Modelling the spatiotemporal dynamics of chemovirotherapy cancer treatment,17,2017,1
156, Mathematical model on Alzheimer's disease,43,2016,1
157,Is mammography screening beneficial: An individual-based stochastic model for breast cancer incidence and mortality,0,2020,1
158,Cell-line-specific network models of ER+ breast cancer identify PI3Kα inhibitor sensitivity factors and drug combinations,0,2020,1
159, Breast cancer mortality in Saudi Arabia: Modelling observed and unobserved factors,19,2018,1
160,Role of texture analysis in breast MRI as a cancer biomarker: A review,24,2019,1
161,"Targeted dose enhancement in radiotherapy for breast cancer using gold nanoparticles, part 1: A radiobiological model study",22,2017,1
162,Tumor heterogeneity correlates with less immune response and worse survival in breast cancer patients,27,2019,1
163," Estimation of breast tumour size, location and pre-processing algorithm for the breast thermal signatures",0,2018,1
164,A novel approach for breast cancer prediction using optimized ANN classifier based on big data environment,1,2019,1
165,Alternative Polyadenylation Modifies Target Sites of MicroRNAs with Clinical Potential for Breast Cancer Progression,2,2019,1
166,A new fractional model and optimal control of a tumor-immune surveillance with non-singular derivative operator,96,2019,1
167,Dynamic modeling of signal transduction by mTOR complexes in cancer,7,2019,1
168, Mathematical Simulation of Heat Transfer Processes in a Breast with a Malignant Tumor.,15,2018,1
169,Novel Thermal Image Classification Based on Techniques Derived from Mathematical Morphology: Case of Breast Cancer,0,2020,1
170,Performance of ultrafast DCE-MRI for diagnosis of prostate cancer,15,2018,1
171,… of concomitant chemo-radiotherapy in patients with locally-advanced squamous cell carcinoma of the head-and-neck in the light of a novel mathematical model,9,2016,1
172,A novel approach for breast cancer investigation and recognition using M-level set-based optimization functions,2,2019,1
173,Breast cancer detection in mammograms using convolutional neural network,29,2018,1
174,A Complex Systems Model of Breast Cancer Etiology: The Paradigm II Conceptual Model,0,2020,1
175,Breast cancer detection in the iot health environment using modified recursive feature selection,7,2019,1
176, Mathematical and numerical analysis of a mathematical model of mixed immunotherapy and chemotherapy of cancer,2,2016,1
177,Self-assembled amphiphilic chitosan nanoparticles for quercetin delivery to breast cancer cells,20,2018,1
178, Breast cancer multi-classification from histopathological images with structured deep learning model,179,2017,1
179,Clinical and molecular relevance of mutant-allele tumor heterogeneity in breast cancer,14,2017,1
180, A highly predictive model for diagnosis of colorectal neoplasms using plasma microRNA: improving specificity and sensitivity,38,2016,1
181, BGRMI: A method for inferring gene regulatory networks from time-course gene expression data and its application in breast cancer research,21,2016,1
182,[CITATION][C] Mathematical modeling of female breast cancer in Japan,0,2020,1
183, Mathematical Modeling for Breast Cancer Risk Assessment,0,0,1
184,Integrating mathematical modeling into the roadmap for personalized adaptive radiation therapy,10,2019,1
185,Thymoquinone Enhances Paclitaxel Anti-Breast Cancer Activity via Inhibiting Tumor-Associated Stem Cells Despite Apparent Mathematical Antagonism,6,2020,1
186,Binary whale optimization algorithm and binary moth flame optimization with clustering algorithms for clinical breast cancer diagnoses,2019,2019,1
187,The microRNA target site landscape is a novel molecular feature associating alternative polyadenylation with immune evasion activity in breast cancer,0,2020,1
188,"Breast cancer risk models: a comprehensive overview of existing models, validation, and clinical applications",75,2017,1
189,Systems approaches to cancer biology,13,2016,1
190, … of a prediction model based on LASSO regression to evaluate the risk of non-sentinel lymph node metastasis in Chinese breast cancer patients with 1-2 …,0,2020,1
191, Multilayer approach reveals organizational principles disrupted in breast cancer co-expression networks,0,2020,1
192,"Using resistin, glucose, age and bmi and pruning fuzzy neural network for the construction of expert systems in the prediction of breast cancer",23,2019,1
193, HER2-HER3 dimer quantification by FLIM-FRET predicts breast cancer metastatic relapse independently of HER2 IHC status,18,2016,1
194,A mathematical model of white blood cell dynamics during maintenance therapy of childhood acute lymphoblastic leukemia,4,2019,1
195,Delineating the evolutionary dynamics of cancer from theory to reality,2,2020,1
196,On Consolidated Predictive Model of the Natural History of Breast Cancer: Primary Tumor and Secondary Metastases in Patients with Lymph Nodes Metastases,1,2017,1
197,Thick tissue diffusion model with binding to optimize topical staining in fluorescence breast cancer margin imaging,0,2018,1
198,Dextran-Curcumin Nanoparticles as a Methotrexate Delivery Vehicle: A Step Forward in Breast Cancer Combination Therapy,6,2020,1
199,Divergent use of metabolic fluxes in breast cancer metastasis,0,2020,1
200,Breast cancer diagnosis from mammographic images using optimized feature selection and neural network architecture,0,2020,1
201, Circulating cell-free DNA-based epigenetic assay can detect early breast cancer,55,2016,1
202, Personalized breast cancer screening strategies: A systematic review and quality assessment,5,2019,1
203,Performance evaluation of extended EXACT algorithm for analyzing breast cancer using fractal dimension,2016,2016,1
204,Modeling treatment of cancer using oncolytic virotherapy with saturated incidence,1,2020,1
205,Impact of early breast cancer screening on mortality among young survivors of childhood Hodgkin's lymphoma,22,2016,1
206,Inference of protein-protein networks for triple-negative breast cancer using single-patient proteomic data,0,2018,1
207,Immunologic consequences of sequencing cancer radiotherapy and surgery,7,2019,1
208,The Natural History of Breast Cancer,2,2017,1
209,Treatment of breast cancer with engineered novel pH-sensitive triaryl-(Z)-olefin niosomes containing hydrogel: an in vitro and in vivo study,3,2020,1
210,Mathematical Modeling of Breast Tumor Destruction Using Fast Heating during Radiofrequency Ablation,4,2020,1
211,A multiscale mathematical model of tumour invasive growth,25,2017,1
212,"Infrared imaging technology for breast cancer detection–Current status, protocols and new directions",66,2017,1
213, Activated oncogenic pathway modifies Iron network in breast epithelial cells: a dynamic modeling perspective,10,2017,1
214,Abstract P4-21-24: Development of mathematical prediction models to identify disease-free survival events for HER2-positive primary breast cancer patients treated by …,0,2017,1
215,Preclinical Molecular Imaging for Precision Medicine in Breast Cancer Mouse Models,3,2019,1
216,Revisiting bevacizumab+ cytotoxics scheduling using mathematical modeling: proof of concept study in experimental non‐small cell lung carcinoma,11,2018,1
217,Rest-activity rhythm in breast cancer survivors: an update based on non-parametric indices,0,2020,1
218,Histopathological image analysis for breast cancer detection using cubic SVM,2020,2020,1
219,A Comparative Study between simulation of Machine Learning and Extreme Learning Techniques on Breast Cancer Diagnosis,1,2020,1
220,Microfluidic channel for characterizing normal and breast cancer cells,16,2017,1
221,International evaluation of an AI system for breast cancer screening,231,2020,1
222,Hunt for the tipping point during endocrine resistance process in breast cancer by dynamic network biomarkers,20,2019,1
223, Modelling of macrophage interactions in breast cancer by partial differential equations,0,2017,1
