,title,cited_by,year,tweeted_by
224, Dose-and time-dependence of the host-mediated response to paclitaxel therapy: a mathematical modeling approach,3,2018,1
225, Transient Bioheat Equation in Breast Tissue: Effect of Tumor Size and Location,1,2020,1
226,The University of Wisconsin breast cancer epidemiology simulation model: an update,21,2018,1
227,Support vector machine for breast cancer classification using diffusion‐weighted MRI histogram features: Preliminary study,30,2018,1
228, Determination of Breast Tumor BIRADS Variant Using Physical Parameter on the Mammography X-Ray Film,0,2016,1
229, A biobank of breast cancer explants with preserved intra-tumor heterogeneity to screen anticancer compounds,241,2016,1
230,A multifunctional nanomedicine platform for co-delivery of methotrexate and mild hyperthermia towards breast cancer therapy,0,2020,1
231,Revisiting dosing regimen using PK/PD modeling: the MODEL1 phase I/II trial of docetaxel plus epirubicin in metastatic breast cancer patients,19,2016,1
232, Predicting drug combination index and simulating the network-regulation dynamics by mathematical modeling of drug-targeted EGFR-ERK signaling pathway,21,2017,1
233,Pharmacodynamic analysis of eribulin safety in breast cancer patients using real‐world postmarketing surveillance data,3,2018,1
234,Trainable Model Based on New Uniform LBP Feature to Identify the Risk of the Breast Cancer,7,2019,1
235,Increased cellular levels of MicroRNA-9 and MicroRNA-221 correlate with cancer stemness and predict poor outcome in human breast cancer,20,2018,1
236,A dynamic gradient boosting machine using genetic optimizer for practical breast cancer prognosis,21,2019,1
237,NUMERICAL EVALUATION OF SCAR AFTER BREAST RECONSTRUCTION WITH ABDOMINAL ADVANCEMENT FLAP.,0,2017,1
238,Mathematical modelling of radiation-induced cancer risk from breast screening by mammography,5,2017,1
239, Mathematical modeling in cancer nanomedicine: a review,30,2019,1
240,Mathematical Modeling for Predicting Chemotherapy and Nanoparticle Treatment Efficacy in Breast Cancer,0,2017,1
241,"Cotinus coggygria Scop. induces cell cycle arrest, apoptosis, genotoxic effects, thermodynamic and epigenetic events in MCF7 breast cancer cells",0,2020,1
242, Anti-angiogenic drug scheduling optimisation with application to colorectal cancer,2,2018,1
243,Generalized Multiscale RBF Networks and the DCT for Breast Cancer Detection,1,2020,1
244,Mathematical modeling of the tumor cells population dynamics in breast cancer/Amin Oroji,0,2018,1
245, Semantic Web Based ST Algorithm Framework for Diagnosing and Monitoring of Breast Cancer on an Intelligent Personal Agent (IPA),0,0,1
246, Current status of lectin-based cancer diagnosis and therapy,30,2017,1
247,Using Hidden Markov Model to Predict Recurrence of Breast Cancer Based on Sequential Patterns in Gene Expression Profiles,0,2020,1
248, Review of non-clinical risk models to aid prevention of breast cancer,7,2018,1
249,Enhancing radiotherapy effect in breast cancer with nanoparticles: A review,4,2019,1
250,Mathematical modeling and computational prediction of cancer drug resistance,34,2018,1
251,Artificial intelligence in breast imaging,32,2019,1
252,A new approach for microcalcification enhancement in digital breast tomosynthesis reconstruction,2,2019,1
253,Automated characterization and counting of Ki-67 protein for breast cancer prognosis: A quantitative immunohistochemistry approach,15,2017,1
254,Combining multiscale experimental and computational systems pharmacological approaches to overcome resistance to HER2-targeted therapy in breast cancer,4,2019,1
255,A model for transfer of P-glycoproteins in MCF-7 breast cancer cell line with multiple transfer rules,1,2017,1
256,Firefly Optimization based Segmentation Technique to analyze Medical Images of Breast Cancer,0,2020,1
257,Ultrasonically controlled estrone-modified liposomes for estrogen-positive breast cancer therapy,18,2018,1
258, trends and projections in Breast cancer Mortality among four Asian countries (1990–2017): Evidence from five Stochastic Mortality Models,0,2020,1
259, Involvement of machine learning for breast cancer image classification: a survey,35,2017,1
260,Chitosan Hydrogels for Synergistic Delivery of Chemotherapeutics to Triple Negative Breast Cancer Cells and Spheroids,0,2020,1
261,A distributed key authentication and OKM-ANFIS scheme based breast cancer prediction system in the IoT environment,0,2020,1
262, Defining cancer subpopulations by adaptive strategies rather than molecular properties provides novel insights into intratumoral evolution,75,2017,1
263,Quantitative assessment of cold atmospheric plasma anti‐cancer efficacy in triple‐negative breast cancers,15,2018,1
264, Systems modelling of the EGFR-PYK2-c-Met interaction network predicts and prioritizes synergistic drug combinations for triple-negative breast cancer,8,2018,1
265," Bio-fabrication of silver nanoparticles by phycocyanin, characterization, in vitro anticancer activity against breast cancer cell line and in vivo cytotxicity",64,2017,1
266,Blackboard to bedside: a mathematical modeling bottom-up approach toward personalized cancer treatments,10,2019,1
267, Supplementary data for the biological age linked to oxidative stress modifies breast cancer aggressiveness,0,2018,1
268,Relative and Absolute Expression Analysis of MicroRNAs Associated with Luminal A Breast Cancer–A Comparison,4,2019,1
269,A review of cell-based computational modeling in cancer biology,54,2019,1
270,Enhanced penetration and cytotoxicity of metformin and collagenase conjugated gold nanoparticles in breast cancer spheroids,5,2019,1
271, In Silico Assessment Of The Impedance Parameters Of Tissue Using A 3D Finite Element Model To Detect Breast Cancer,0,2020,1
272,Two-dimensional finite element model of breast cancer cell motion through a microfluidic channel,0,2019,1
273,Improved cost-sensitive support vector machine classifier for breast cancer diagnosis,8,2018,1
274,Mutational signatures in breast cancer: the problem at the DNA level,74,2017,1
275,Optimal Control of Breast Cancer: Investigating Estrogen as a Risk Factor,0,2017,1
276,Computational growth model of breast microcalcification clusters in simulated mammographic environments,9,2016,1
277,Estimating Muscle Forces for Breast Cancer Survivors During Functional Tasks,0,2020,1
278,Multiscale treatment response model for triple-negative breast cancer linking drug pharmacokinetics to tumor cell population dynamics,0,2016,1
279, The clinical application of Raman spectroscopy for breast cancer detection,21,2017,1
280,Machine Learning Based Classifier for Breast Cancer Prediction,0,2020,1
281, Simulation model for breast cancer management in India,0,5,1
282, Performance of Mid‐Treatment Breast Ultrasound and Axillary Ultrasound in Predicting Response to Neoadjuvant Chemotherapy by Breast Cancer Subtype,9,2017,1
283,Prediction of postoperative disease-free survival and brain metastasis for HER2-positive breast cancer patients treated with neoadjuvant chemotherapy plus …,4,2018,1
284,An improved hybrid active contour model for nuclear segmentation on breast cancer histopathology,10,2016,1
285,Natural History of Breast Cancer: Reanalyze Nodal Stage and Oestrogen Receptor Status Affecting the Progression of Breast Cancer from SEER Database,0,202,1
286,2D Microwave Imaging of the Breast Tissue: Forward Problem Technique,0,2019,1
287,Computational studies on breast cancer analysis,0,2020,1
288, Artificial intelligence methods for the diagnosis of breast cancer by image processing: a review,22,2018,1
289,Embedded drug delivery controller for cancer chemotherapy under treatment constrains,5,2017,1
290,Penetrance of ATM Gene Mutations in Breast Cancer: A Meta‐Analysis of Different Measures of Risk,49,2016,1
291,Assessment of breast cancer risk factors among women of reproductive age group in Oshogbo using Gail model,0,2019,1
292,A proposal for pathologic processing of breast implant capsules in patients with suspected breast implant anaplastic large cell lymphoma,3,2020,1
293, Modulation of the leptin receptors expression in breast cancer cell lines exposed to leptin and tamoxifen,2,2019,1
294, Survival and time to initiation of adjuvant chemotherapy among breast cancer patients: a systematic review and meta-analysis,23,2018,1
295, Mathematical analysis of the Cancitis model and the role of inflammation in blood cancer progression,4,2019,1
296,Atomic force microscopy indentation and inverse analysis for non-linear viscoelastic identification of breast cancer cells,17,2016,1
297,Mathematical models of breast and ovarian cancers,11,2016,1
298,Prediction Model for Breast Cancer Detection Using Machine Learning Algorithms,0,2020,1
299, Discrimination of breast cancer with microcalcifications on mammography by deep learning,149,2016,1
300, … Screening Schedules under Varying Resource Constraints for Planning Breast Cancer Control Programs in Low-and Middle-Income Countries: A Mathematical …,0,2020,1
301, BOADICEA: a comprehensive breast cancer risk prediction model incorporating genetic and nongenetic risk factors,90,2019,1
302,Abstract PD3-15: Novel cFlip inhibitor suppresses chemotherapy-induced breast cancer stem cell activity through blocking HIF1-α,0,2018,1
303,Bayesian inference identifies combination therapeutic targets in breast cancer,7,2019,1
304,Deep learning modeling using normal mammograms for predicting breast cancer risk,10,2020,1
305,"Axillary lymph node dissection in node-positive breast cancer: are ten nodes adequate and when is enough, enough?",1,2020,1
306,Distinct Glycosylations Lead to Breast Cancer Cell Adhesion to E-selectin,0,2016,1
307,Cost-effectiveness models in breast cancer screening in the general population: a systematic review,12,2017,1
308,Moment stability for nonlinear stochastic growth kinetics of breast cancer stem cells with time-delays,8,2016,1
309, Integrating evolutionary dynamics into treatment of metastatic castrate-resistant prostate cancer,269,2017,1
310,Polarization‐dependent second‐harmonic generation for collagen‐based differentiation of breast cancer samples,0,2020,1
311, Mathematical modeling for Phase I cancer trials: A study of metronomic vinorelbine for advanced non-small cell lung cancer (NSCLC) and mesothelioma …,16,2017,1
312," Effectiveness of Gail Model in Assessing the Risk of Developing Breast Cancer in Baghdad, Iraq",0,2020,1
313," Determining the thermal characteristics of breast cancer based on high-resolution infrared imaging, 3D breast scans, and magnetic resonance imaging",1,2020,1
314,[CITATION][C] A multi-scale mathematical model of combination targeted and cytotoxic therapy to evaluate treatment response in HER2+ breast cancer,0,2019,1
315, A technical review of convolutional neural network-based mammographic breast cancer diagnosis,18,2019,1
316, PIK3CA-CDKN2A clonal evolution in metastatic breast cancer and multiple points cell-free DNA analysis,0,2019,1
317,Supervariants identification for breast cancer,0,2020,1
318,"… for potential postsurgical breast cancer treatment: a single platform for synergistic inhibition of local regional breast cancer recurrence, surveillance, and healthy breast …",16,2018,1
319, From Breast Cancer to Computational Science,0,2018,1
320, MiR-1976 knockdown promotes epithelial–mesenchymal transition and cancer stem cell properties inducing triple-negative breast cancer metastasis,0,2020,1
321, A mathematical framework for modelling the metastatic spread of cancer,16,2019,1
322,Microstructural models for diffusion MRI in breast cancer and surrounding stroma: an ex vivo study,15,2017,1
323,Repurposing suramin for the treatment of breast cancer lung metastasis with glycol chitosan-based nanoparticles,7,2019,1
324, A mathematical study of the impact of cell plasticity on tumour control probability,1,2020,1
325,Enhanced performance of macrophage-encapsulated nanoparticle albumin-bound-paclitaxel in hypo-perfused cancer lesions,35,2016,1
326, A highly potent PROTAC androgen receptor (AR) degrader ARD-61 effectively inhibits AR-positive breast cancer cell growth in vitro and tumor growth in vivo,0,2020,1
327,SUPPORT TOOL FOR DECISION-MAKING IN SELECTING CHEMOTHERAPY TACTICS FOR TREATMENT OF BREAST CANCER PATIENTS.,0,2019,1
328,Effect of Erufosine on Membrane Lipid Order in Breast Cancer Cell Models,0,2020,1
329,Cancerous nuclei detection and scoring in breast cancer histopathological images,7,2016,1
330,A novel intelligent classification model for breast cancer diagnosis,27,2019,1
331,Computer-aided diagnosis system combining FCN and Bi-LSTM model for efficient breast cancer detection from histopathological images,16,2019,1
332,INTERNAL TEMPERATURE FIELD ESTIMATION IN WATER-FILTERED INFRA-RED-A (wIRA) HYPERTHERMIA OF BREAST CANCER FROM SKIN SURFACE …,0,2018,1
333,Adaptive decision-making of breast cancer mammography screening: A heuristic-based regression model,7,2018,1
334, Ultrasound-activated piezoelectric nanoparticles inhibit proliferation of breast cancer cells,23,2018,1
335,Finite difference method based analysis of bio-heat transfer in human breast cyst,10,2019,1
336,Breast cancer classification from histopathological images with inception recurrent residual convolutional neural network,53,2019,1
337,Evaluation of computationally intelligent techniques for breast cancer diagnosis,0,2020,1
338,A tissue-engineered 3D microvessel model reveals the dynamics of mosaic vessel formation in breast cancer,1,2020,1
339,Formulation-optimization of solid lipid nanocarrier system of STAT3 inhibitor to improve its activity in triple negative breast cancer cells,14,2019,1
340, The Framingham risk score underestimates the risk of cardiovascular events in the HER2-positive breast cancer population,13,2017,1
341,Analyses of BMAL1 and PER2 Oscillations in a Model of Breast Cancer Progression Reveal Changes With Malignancy,7,2019,1
342, Applying data-driven imaging biomarker in mammography for breast cancer screening: preliminary study,22,2018,1
343,Abstract A29: Mathematical models are not the be-all and end-all for breast cancer risk assessment,0,2017,1
344,Dose-dense adjuvant chemotherapy: a systematic review and meta-analysis of the Japanese Breast Cancer Society Clinical Practice Guideline,1,2020,1
345, Normal breast tissue DNA methylation differences at regulatory elements are associated with the cancer risk factor age,27,2017,1
346,Machine learning with applications in breast cancer diagnosis and prognosis,50,2018,1
347,Study on Breast Tumor Detection Based on Lasso-BP Neural Network,0,2020,1
348," Size-Optimized Ultrasmall Porous Silica Nanoparticles Depict Vasculature-Based Differential Targeting in Triple Negative Breast Cancer Shreya Goel, Carolina …",0,0,1
349, Expression of AdipoR1 and AdipoR2 receptors as leptin-breast cancer regulation mechanisms,8,2017,1
350, Primary Tumor Removal Improves the prognosis In Patients with Stage IV Breast Cancer: A Population-Based Study (Cohort Study),0,2020,1
351, Overexpression of mir-183 and mir-494 promotes proliferation and migration in human breast cancer cell lines,30,2017,1
352,A novel integrated diagnosis method for breast cancer detection,2,2020,1
353, Expression of tumor suppressors miR-195 and let-7a as potential biomarkers of invasive breast cancer,10,2018,1
354,PRINCESS: Prediction of Individual Breast Cancer Evolution to Surgical Size,0,2020,1
355,An immune‐related prognostic signature for predicting breast cancer recurrence,1,2020,1
356,A mathematical model of nutrient influence on fungal competition,6,2018,1
357,Wavelet‐based scaling indices for breast cancer diagnostics,6,2017,1
358,Automatic nonlinear filtering and segmentation for breast ultrasound images,11,2016,1
359, A Personalized Physical Activity Coaching App for Breast Cancer Survivors: Design Process and Early Prototype Testing,0,2020,1
360,[CITATION][C] A mathematical model for predicting immune response in a trastuzumab treated HER2+ breast cancer animal model: Preliminary efforts,0,2018,1
361, The in vitro radiosensitizer potential of resveratrol on MCF-7 breast cancer cells,15,2018,1
362,[CITATION][C] … model of pathologic response based on tumor cellularity and tumor-infiltrating lymphocytes (CelTIL) in HER2-positive breast cancer treated with chemo …,23,2018,1
363,Machine learning assisted prognostication model based on genomic expression in the tumor microenvironment of stage II and III breast cancer,0,2020,1
364, Development of digital breast tomosynthesis and diffuse optical tomography fusion imaging for breast cancer detection,0,2020,1
365, Comparative evaluation of network features for the prediction of breast cancer metastasis,2,2020,1
366, A physical mechanism and global quantification of breast cancer,14,2016,1
367,The immune checkpoint kick start: Optimization of neoadjuvant combination therapy using game theory,13,2019,1
368,Molecular natural history of breast cancer: Leveraging transcriptomics to predict breast cancer progression and aggressiveness,0,2020,1
369,Breast cancer prediction model based on logical programming algorithm,0,2020,1
370,Antitumor effects of lidocaine on human breast cancer cells: An in vitro and in vivo experimental trial,25,2018,1
371,Assessing the impact of the addition of dendritic cell vaccination to neoadjuvant chemotherapy in breast cancer patients: A model‐based characterization approach,3,2019,1
372,Axillary Nodal Examination in Breast Cancer: How Much Is Enough? Evidence for a New Minimum,1,2016,1
373,Classification of Breast Cancer Malignancy Using Machine Learning Mechanisms in TensorFlow and Keras,0,2019,1
374, The Menstrual Cycle and Risk of Breast Cancer: A Review,2,2020,1
375,CAD and AI for breast cancer—recent development and challenges,6,2019,1
376,Thermal Imaging-An Emerging Modality for Breast Cancer Detection: A Comprehensive Review,0,2020,1
377,Weight and weight changes in early adulthood and later breast cancer risk,57,2017,1
378, Diffusion-Weighted Magnetic Resonance Imaging of Patients with Breast Cancer Following Neoadjuvant Chemotherapy Provides Early Prediction of …,6,2019,1
379,Current status of mathematical modeling of cancer–From the viewpoint of cancer hallmarks,2017,2017,1
380,Competing endogenous RNA (ceRNA) cross talk and language in ceRNA regulatory networks: a new look at hallmarks of breast cancer,76,2019,1
381, Integrative analysis of mutational and transcriptional profiles reveals driver mutations of metastatic breast cancers,36,2016,1
382, Implementation of an ontological reasoning to support the guideline-based management of primary breast cancer patients in the DESIREE project,0,2020,1
383, Dynamic targeting in cancer treatment,7,2019,1
384, Pattern recognition approaches for breast cancer DCE-MRI classification: a systematic review,47,2016,1
385,A mathematical multi-organ model for bidirectional epithelial–mesenchymal transitions in the metastatic spread of cancer,4,2020,1
386,Irreversible electroporation inhibits pro-cancer inflammatory signaling in triple negative breast cancer cells,15,2017,1
387, On a stochastic neuronal model integrating correlated inputs,9,2019,1
388, HER2-HER3 dimer quantification by FLIM-FRET predicts breast cancer metastatic relapse,0,7,1
389, Pharmacokinetic-pharmacodynamic modeling of the antitumor effect of TM208 and EGFR-TKI resistance in human breast cancer xenograft mice,5,2016,1
390, … disease after neoadjuvant therapy and in carcinoma in situ: a report of the International Immuno-Oncology Biomarker Working Group on Breast Cancer,105,2018,1
391,Particle swarm optimization feature selection for breast cancer recurrence prediction,38,2018,1
392,A theoretical model describing the dynamics of venous flow in the DIEP flap,1,2019,1
393,Cox Proportional Hazard Survival Analysis to Inpatient Breast Cancer Cases,0,2018,1
394,Detection and classification of breast cancer from digital mammograms using hybrid extreme learning machine classifier,0,2020,1
395,"Curcumin nanocochleates: Use of design of experiments, solid state characterization, in vitro apoptosis and cytotoxicity against breast cancer MCF-7 cells",11,2018,1
396,Natural language processing approaches to detect the timeline of metastatic recurrence of breast cancer,7,2019,1
397,Acid-sensitive lipidated doxorubicin prodrug entrapped in nanoemulsion impairs lung tumor metastasis in a breast cancer model,13,2017,1
398, Modeling breast cancer progression to bone: how driver mutation order and metabolism matter,3,2019,1
399,A data mining model to predict breast cancer using improved feature selection method on real time data,2018,2018,1
400,Regularized multi-view subspace clustering for common modules across cancer stages,7,2018,1
401, A DNA Methylation-Based Panel for the Prognosis and Dagnosis of Patients With Breast Cancer and Its Mechanisms,0,2020,1
402, Heritable DNA methylation marks associated with susceptibility to breast cancer,36,2018,1
403,Gene signature‐based prediction of triple‐negative breast cancer patient response to Neoadjuvant chemotherapy,0,2020,1
404,Epithelial/mesenchymal plasticity: how have quantitative mathematical models helped improve our understanding?,38,2017,1
405,Pharmacokinetics and pharmacodynamics-based mathematical modeling identifies an optimal protocol for metronomic chemotherapy,21,2017,1
406, Radiogenomic signatures reveal multiscale intratumour heterogeneity associated with biological functions and survival in breast cancer,0,2020,1
407,Metronomics in the neoadjuvant and adjuvant treatment of breast cancer,9,2017,1
408, Machine Learning to Guide the use of Adjuvant Therapies for Breast Cancer,0,2020,1
409, Analyzing Relationship Between Local and Metastasis Relapses with Survival of Patients with Breast Cancer: A Study Using Joint Frailty Model,5,2018,1
410, Evaluation of clinical parameters influencing the development of bone metastasis in breast cancer,30,2016,1
411, Reproductive and hormonal risk factors of breast cancer: a historical perspective,18,2017,1
412,Impact of the delayed initiation of adjuvant chemotherapy in the outcome of triple-negative breast cancer,2020,2020,1
413,Orai3 calcium channel and resistance to chemotherapy in breast cancer cells: the p53 connection,40,2018,1
414,Design and construction of applicator antennas for the breast cancer treatment,2018,2018,1
415,Multicenter study using desorption-electrospray-ionization-mass-spectrometry imaging for breast-cancer diagnosis,28,2018,1
416,In vitro release kinetics model fitting of liposomes: An insight,63,2016,1
417,Breast cancer diagnosis using feature ensemble learning based on stacked sparse autoencoders and softmax regression,28,2019,1
418," … , multicenter French study evaluating the clinical impact of the Breast Cancer Intrinsic Subtype-Prosigna® Test in the management of early-stage breast …",9,2017,1
419,Breast cancer stem cell: the roles and therapeutic implications,54,2017,1
420,The influence of the electrode dimension on the detection sensitivity of electric cell–substrate impedance sensing (ECIS) and its mathematical modeling,21,2017,1
421,Loss of ZIP facilitates JAK2-STAT3 activation in tamoxifen-resistant breast cancer,0,2020,1
422, Integration of transcriptomic data in a genome-scale metabolic model to investigate the link between obesity and breast cancer,7,2019,1
423,Can a machine-learning model improve the prediction of nodal stage after a positive sentinel lymph node biopsy in breast cancer?,0,2020,1
424,Joint models of tumour size and lymph node spread for incident breast cancer cases in the presence of screening,2,2019,1
425,Rationally designed 2-in-1 nanoparticles can overcome adaptive resistance in cancer,42,2016,1
426,Mutation Mechanisms of Breast Cancer among the Female Population in China,0,2020,1
427,Understanding intratumor heterogeneity by combining genome analysis and mathematical modeling,14,2018,1
428,Deep learning and optimization algorithms for automatic breast cancer detection,2020,2020,1
429,The genomic landscape of metastatic breast cancer highlights changes in mutation and signature frequencies,40,2019,1
430,Doxorubicin loaded liposomal nanoparticles containing quantum dot for treatment of breast cancer,1,2019,1
431,"HDAC6 Plays a Noncanonical Role in the Regulation of Antitumor Immune Responses, Dissemination, and Invasiveness of Breast Cancer",0,2020,1
432,MiR-195 regulates mitochondrial function by targeting mitofusin-2 in breast cancer cells,7,2019,1
433,A comparative study of breast cancer tumor classification by classical machine learning methods and deep learning method,0,2020,1
434,Next-Generation Sequencing Identifies BRCA1 and/or BRCA2 Mutations in Women at High Hereditary Risk for Breast Cancer with Shorter Telomere Length,1,2020,1
435,A neural network based breast cancer prognosis model with PCA processed features,2016,2016,1
436,Identifying predictive factors for neuropathic pain after breast cancer surgery using machine learning,0,2020,1
437, Finite Element Method Approach for Thermal Analysis of Female Breast Tissue Tumor Model,0,2017,1
438,Magnetic resonance imaging features for predicting axillary lymph node metastasis in patients with breast cancer,0,2020,1
439,Optimal control of a delayed breast cancer stem cells nonlinear model,5,2016,1
440, Spectrochemical analysis of liquid biopsy harnessed to multivariate analysis towards breast cancer screening,0,2020,1
441,Human Breast Cancer Xenograft Model Implicates Peroxisome Proliferator–activated Receptor Signaling as Driver of Cancer-induced Muscle Fatigue,4,2019,1
442,A Comparative Study of Meta Heuristic Model to Assess the Type of Breast Cancer Disease,0,2020,1
443,Precision medicine and radiogenomics in breast cancer: new approaches toward diagnosis and treatment,67,2018,1
